### ISSUE TITLE
Proxy does not work

### ISSUE THREAD

**Issue by oSkrobuk** [greenplum-db/gpdb#12027]
### Greenplum version or build
PostgreSQL 9.4.24 (Greenplum Database 6.12.1) on x86_64-pc-linux-gnu, compiled by gcc (Ubuntu 5.4.0-6ubuntu1~16.04.12) 5.4.0 20160609, 64-bit compiled on Nov 24 2020 14:10:52

### OS version and uname -a
Linux gpdb-master-01 4.19.62-13 #1 SMP Mon Jul 29 17:22:59 UTC 2019 x86_64 x86_64 x86_64 GNU/Linux

### autoconf options used ( config.status --config )
'--build=x86_64-linux-gnu' '--prefix=/usr' '--includedir=${prefix}/include' '--mandir=${prefix}/share/man' '--infodir=${prefix}/share/info' '--sysconfdir=/etc' '--localstatedir=/var' '--disable-silent-rules' '--libdir=${prefix}/lib/x86_64-linux-gnu' '--libexecdir=${prefix}/lib/x86_64-linux-gnu' '--disable-maintainer-mode' '--disable-dependency-tracking' '--with-perl' '--with-python' '--without-gssapi' '--disable-gpcloud' '--enable-ic-proxy' '--with-libxml' '--with-system-tzdata=/usr/share/zoneinfo' '--prefix=/usr/local/gpdb' 'build_alias=x86_64-linux-gnu' 'CFLAGS=-g -O2 -fstack-protector-strong -Wformat -Werror=format-security' 'LDFLAGS=-Wl,-Bsymbolic-functions -Wl,-z,relro' 'CPPFLAGS=-Wdate-time -D_FORTIFY_SOURCE=2' 'CXXFLAGS=-g -O2 -fstack-protector-strong -Wformat -Werror=format-security'

### Installation information ( pg_config )
BINDIR = /usr/local/gpdb/bin
DOCDIR = /usr/local/gpdb/share/doc/postgresql
HTMLDIR = /usr/local/gpdb/share/doc/postgresql
INCLUDEDIR = /usr/local/gpdb/include
PKGINCLUDEDIR = /usr/local/gpdb/include/postgresql
INCLUDEDIR-SERVER = /usr/local/gpdb/include/postgresql/server
LIBDIR = /usr/local/gpdb/lib/x86_64-linux-gnu
PKGLIBDIR = /usr/local/gpdb/lib/x86_64-linux-gnu/postgresql
LOCALEDIR = /usr/local/gpdb/share/locale
MANDIR = /usr/local/gpdb/share/man
SHAREDIR = /usr/local/gpdb/share/postgresql
SYSCONFDIR = /etc/postgresql
PGXS = /usr/local/gpdb/lib/x86_64-linux-gnu/postgresql/pgxs/src/makefiles/pgxs.mk
CONFIGURE = '--build=x86_64-linux-gnu' '--prefix=/usr' '--includedir=/usr/local/gpdb/include' '--mandir=/usr/local/gpdb/share/man' '--infodir=/usr/local/gpdb/share/info' '--sysconfdir=/etc' '--localstatedir=/var' '--disable-silent-rules' '--libdir=/usr/local/gpdb/lib/x86_64-linux-gnu' '--libexecdir=/usr/local/gpdb/lib/x86_64-linux-gnu' '--disable-maintainer-mode' '--disable-dependency-tracking' '--with-perl' '--with-python' '--without-gssapi' '--disable-gpcloud' '--enable-ic-proxy' '--with-libxml' '--with-system-tzdata=/usr/share/zoneinfo' '--prefix=/usr/local/gpdb' 'build_alias=x86_64-linux-gnu' 'CFLAGS=-g -O2 -fstack-protector-strong -Wformat -Werror=format-security' 'LDFLAGS=-Wl,-Bsymbolic-functions -Wl,-z,relro' 'CPPFLAGS=-Wdate-time -D_FORTIFY_SOURCE=2' 'CXXFLAGS=-g -O2 -fstack-protector-strong -Wformat -Werror=format-security'
CC = gcc
CPPFLAGS = -Wdate-time -D_FORTIFY_SOURCE=2 -D_GNU_SOURCE -I/usr/include/libxml2 -I/usr/local/gpdb/include
CFLAGS = -Wall -Wmissing-prototypes -Wpointer-arith -Wendif-labels -Wmissing-format-attribute -Wformat-security -fno-strict-aliasing -fwrapv -fexcess-precision=standard -fno-aggressive-loop-optimizations -Wno-unused-but-set-variable -Wno-address -g -O2 -fstack-protector-strong -Wformat -Werror=format-security -std=gnu99 -Werror=uninitialized -Werror=implicit-function-declaration -I/usr/local/gpdb/include
CFLAGS_SL = -fPIC
LDFLAGS = -Wl,-Bsymbolic-functions -Wl,-z,relro -Wl,--as-needed -Wl,-rpath,'/usr/local/gpdb/lib/x86_64-linux-gnu',--enable-new-dtags -L/usr/local/gpdb/lib/x86_64-linux-gnu
LDFLAGS_EX =
LDFLAGS_SL =
LIBS = -lpgcommon -lpgport -lxerces-c -lxml2 -lrt -lzstd -lrt -lcrypt -ldl -lm -L/usr/local/gpdb/lib/x86_64-linux-gnu
VERSION = PostgreSQL 9.4.24

### Expected behavior
We expect all workers to communicate with workers on other segments via bgworker

### Actual behavior
```sql
SHOW gp_interconnect_type;
proxy

SHOW gp_interconnect_proxy_addresses;
1:-1:gpdb-master-01:15432,2:0:gpdb-seg-01:16000,3:1:gpdb-seg-01:16001,4:2:gpdb-seg-01:16002,5:3:gpdb-seg-01:16003,6:4:gpdb-seg-01:16004,7:5:gpdb-seg-01:16005,8:6:gpdb-seg-01:16006,9:7:gpdb-seg-01:16007,10:8:gpdb-seg-01:16008,11:9:gpdb-seg-01:16009,12:10:gpdb-seg-01:16010,13:11:gpdb-seg-01:16011,14:12:gpdb-seg-01:16012,15:13:gpdb-seg-01:16013,16:14:gpdb-seg-01:16014,17:15:gpdb-seg-01:16015,18:16:gpdb-seg-02:16000,19:17:gpdb-seg-02:16001,20:18:gpdb-seg-02:16002,21:19:gpdb-seg-02:16003,22:20:gpdb-seg-02:16004,23:21:gpdb-seg-02:16005,24:22:gpdb-seg-02:16006,25:23:gpdb-seg-02:16007,26:24:gpdb-seg-02:16008,27:25:gpdb-seg-02:16009,28:26:gpdb-seg-02:16010,29:27:gpdb-seg-02:16011,30:28:gpdb-seg-02:16012,31:29:gpdb-seg-02:16013,32:30:gpdb-seg-02:16014,33:31:gpdb-seg-02:16015,34:32:gpdb-seg-03:16000,35:33:gpdb-seg-03:16001,36:34:gpdb-seg-03:16002,37:35:gpdb-seg-03:16003,38:36:gpdb-seg-03:16004,39:37:gpdb-seg-03:16005,40:38:gpdb-seg-03:16006,41:39:gpdb-seg-03:16007,42:40:gpdb-seg-03:16008,43:41:gpdb-seg-03:16009,44:42:gpdb-seg-03:16010,45:43:gpdb-seg-03:16011,46:44:gpdb-seg-03:16012,47:45:gpdb-seg-03:16013,48:46:gpdb-seg-03:16014,49:47:gpdb-seg-03:16015,50:48:gpdb-seg-04:16000,51:49:gpdb-seg-04:16001,52:50:gpdb-seg-04:16002,53:51:gpdb-seg-04:16003,54:52:gpdb-seg-04:16004,55:53:gpdb-seg-04:16005,56:54:gpdb-seg-04:16006,57:55:gpdb-seg-04:16007,58:56:gpdb-seg-04:16008,59:57:gpdb-seg-04:16009,60:58:gpdb-seg-04:16010,61:59:gpdb-seg-04:16011,62:60:gpdb-seg-04:16012,63:61:gpdb-seg-04:16013,64:62:gpdb-seg-04:16014,65:63:gpdb-seg-04:16015,66:64:gpdb-seg-05:16000,67:65:gpdb-seg-05:16001,68:66:gpdb-seg-05:16002,69:67:gpdb-seg-05:16003,70:68:gpdb-seg-05:16004,71:69:gpdb-seg-05:16005,72:70:gpdb-seg-05:16006,73:71:gpdb-seg-05:16007,74:72:gpdb-seg-05:16008,75:73:gpdb-seg-05:16009,76:74:gpdb-seg-05:16010,77:75:gpdb-seg-05:16011,78:76:gpdb-seg-05:16012,79:77:gpdb-seg-05:16013,80:78:gpdb-seg-05:16014,81:79:gpdb-seg-05:16015,82:80:gpdb-seg-06:16000,83:81:gpdb-seg-06:16001,84:82:gpdb-seg-06:16002,85:83:gpdb-seg-06:16003,86:84:gpdb-seg-06:16004,87:85:gpdb-seg-06:16005,88:86:gpdb-seg-06:16006,89:87:gpdb-seg-06:16007,90:88:gpdb-seg-06:16008,91:89:gpdb-seg-06:16009,92:90:gpdb-seg-06:16010,93:91:gpdb-seg-06:16011,94:92:gpdb-seg-06:16012,95:93:gpdb-seg-06:16013,96:94:gpdb-seg-06:16014,97:95:gpdb-seg-06:16015,98:96:gpdb-seg-07:16000,99:97:gpdb-seg-07:16001,100:98:gpdb-seg-07:16002,101:99:gpdb-seg-07:16003,102:100:gpdb-seg-07:16004,103:101:gpdb-seg-07:16005,104:102:gpdb-seg-07:16006,105:103:gpdb-seg-07:16007,106:104:gpdb-seg-07:16008,107:105:gpdb-seg-07:16009,108:106:gpdb-seg-07:16010,109:107:gpdb-seg-07:16011,110:108:gpdb-seg-07:16012,111:109:gpdb-seg-07:16013,112:110:gpdb-seg-07:16014,113:111:gpdb-seg-07:16015,114:112:gpdb-seg-08:16000,115:113:gpdb-seg-08:16001,116:114:gpdb-seg-08:16002,117:115:gpdb-seg-08:16003,118:116:gpdb-seg-08:16004,119:117:gpdb-seg-08:16005,120:118:gpdb-seg-08:16006,121:119:gpdb-seg-08:16007,122:120:gpdb-seg-08:16008,123:121:gpdb-seg-08:16009,124:122:gpdb-seg-08:16010,125:123:gpdb-seg-08:16011,126:124:gpdb-seg-08:16012,127:125:gpdb-seg-08:16013,128:126:gpdb-seg-08:16014,129:127:gpdb-seg-08:16015
```

nestat on master:
```
gpadm@gpdb-master-01:~$ netstat -lapt -W | grep "15432"
(Not all processes could be identified, non-owned process info
 will not be shown, you would have to be root to see it all.)
tcp6       0      0 gpdb-master-01:15432 [::]:*            LISTEN      12948/postgres:  54
tcp6       0      0 gpdb-master-01:15432 gpdb-seg-01:36578 ESTABLISHED 12948/postgres:  54
tcp6       0      0 gpdb-master-01:15432 gpdb-seg-05:56798 ESTABLISHED 12948/postgres:  54
tcp6       0      0 gpdb-master-01:15432 gpdb-seg-05:56948 ESTABLISHED 12948/postgres:  54
tcp6       0      0 gpdb-master-01:15432 gpdb-seg-02:36258 ESTABLISHED 12948/postgres:  54
tcp6       0      0 gpdb-master-01:15432 gpdb-seg-07:33142 ESTABLISHED 12948/postgres:  54
tcp6       0      0 gpdb-master-01:15432 gpdb-seg-07:33858 ESTABLISHED 12948/postgres:  54
tcp6       0      0 gpdb-master-01:15432 gpdb-seg-04:48946 ESTABLISHED 12948/postgres:  54
tcp6       0      0 gpdb-master-01:15432 gpdb-seg-08:54436 ESTABLISHED 12948/postgres:  54
tcp6       0      0 gpdb-master-01:15432 gpdb-seg-05:56850 ESTABLISHED 12948/postgres:  54
tcp6       0      0 gpdb-master-01:15432 gpdb-seg-06:38946 ESTABLISHED 12948/postgres:  54
tcp6       0      0 gpdb-master-01:15432 gpdb-seg-05:56864 ESTABLISHED 12948/postgres:  54
tcp6       0      0 gpdb-master-01:15432 gpdb-seg-03:42236 ESTABLISHED 12948/postgres:  54
tcp6       0      0 gpdb-master-01:15432 gpdb-seg-08:54434 ESTABLISHED 12948/postgres:  54
tcp6       0      0 gpdb-master-01:15432 gpdb-seg-07:33374 ESTABLISHED 12948/postgres:  54
tcp6       0      0 gpdb-master-01:15432 gpdb-seg-08:54530 ESTABLISHED 12948/postgres:  54
tcp6       0      0 gpdb-master-01:15432 gpdb-seg-07:33180 ESTABLISHED 12948/postgres:  54
tcp6       0      0 gpdb-master-01:15432 gpdb-seg-06:39004 ESTABLISHED 12948/postgres:  54
tcp6       0      0 gpdb-master-01:15432 gpdb-seg-03:41450 ESTABLISHED 12948/postgres:  54
tcp6       0      0 gpdb-master-01:15432 gpdb-seg-02:36190 ESTABLISHED 12948/postgres:  54
tcp6       0      0 gpdb-master-01:15432 gpdb-seg-01:36638 ESTABLISHED 12948/postgres:  54
tcp6       0      0 gpdb-master-01:15432 gpdb-seg-06:37966 ESTABLISHED 12948/postgres:  54
tcp6       0      0 gpdb-master-01:15432 gpdb-seg-03:41472 ESTABLISHED 12948/postgres:  54
tcp6       0      0 gpdb-master-01:15432 gpdb-seg-05:57152 ESTABLISHED 12948/postgres:  54
tcp6       0      0 gpdb-master-01:15432 gpdb-seg-05:57114 ESTABLISHED 12948/postgres:  54
tcp6       0      0 gpdb-master-01:15432 gpdb-seg-04:48968 ESTABLISHED 12948/postgres:  54
tcp6       0      0 gpdb-master-01:15432 gpdb-seg-01:36648 ESTABLISHED 12948/postgres:  54
tcp6       0      0 gpdb-master-01:15432 gpdb-seg-02:36388 ESTABLISHED 12948/postgres:  54
tcp6       0      0 gpdb-master-01:15432 gpdb-seg-01:36632 ESTABLISHED 12948/postgres:  54
tcp6       0      0 gpdb-master-01:15432 gpdb-seg-08:54284 ESTABLISHED 12948/postgres:  54
tcp6       0      0 gpdb-master-01:15432 gpdb-seg-05:56852 ESTABLISHED 12948/postgres:  54
tcp6       0      0 gpdb-master-01:15432 gpdb-seg-07:33598 ESTABLISHED 12948/postgres:  54
tcp6       0      0 gpdb-master-01:15432 gpdb-seg-08:54512 ESTABLISHED 12948/postgres:  54
tcp6       0      0 gpdb-master-01:15432 gpdb-seg-01:36718 ESTABLISHED 12948/postgres:  54
tcp6       0      0 gpdb-master-01:15432 gpdb-seg-04:49256 ESTABLISHED 12948/postgres:  54
tcp6       0      0 gpdb-master-01:15432 gpdb-seg-08:54088 ESTABLISHED 12948/postgres:  54
tcp6       0      0 gpdb-master-01:15432 gpdb-seg-05:57156 ESTABLISHED 12948/postgres:  54
tcp6       0      0 gpdb-master-01:15432 gpdb-seg-05:57126 ESTABLISHED 12948/postgres:  54
tcp6       0      0 gpdb-master-01:15432 gpdb-seg-02:36396 ESTABLISHED 12948/postgres:  54
tcp6       0      0 gpdb-master-01:15432 gpdb-seg-01:36650 ESTABLISHED 12948/postgres:  54
tcp6       0      0 gpdb-master-01:15432 gpdb-seg-08:54150 ESTABLISHED 12948/postgres:  54
tcp6       0      0 gpdb-master-01:15432 gpdb-seg-04:49584 ESTABLISHED 12948/postgres:  54
tcp6       0      0 gpdb-master-01:15432 gpdb-seg-08:54562 ESTABLISHED 12948/postgres:  54
tcp6       0      0 gpdb-master-01:15432 gpdb-seg-06:38542 ESTABLISHED 12948/postgres:  54
tcp6       0      0 gpdb-master-01:15432 gpdb-seg-02:36376 ESTABLISHED 12948/postgres:  54
tcp6       0      0 gpdb-master-01:15432 gpdb-seg-08:54282 ESTABLISHED 12948/postgres:  54
tcp6       0      0 gpdb-master-01:15432 gpdb-seg-08:54690 ESTABLISHED 12948/postgres:  54
tcp6       0      0 gpdb-master-01:15432 gpdb-seg-06:37564 ESTABLISHED 12948/postgres:  54
tcp6       0      0 gpdb-master-01:15432 gpdb-seg-03:42024 ESTABLISHED 12948/postgres:  54
tcp6       0      0 gpdb-master-01:15432 gpdb-seg-01:36710 ESTABLISHED 12948/postgres:  54
tcp6       0      0 gpdb-master-01:15432 gpdb-seg-06:37432 ESTABLISHED 12948/postgres:  54
tcp6       0      0 gpdb-master-01:15432 gpdb-seg-06:38488 ESTABLISHED 12948/postgres:  54
tcp6       0      0 gpdb-master-01:15432 gpdb-seg-05:56904 ESTABLISHED 12948/postgres:  54
tcp6       0      0 gpdb-master-01:15432 gpdb-seg-03:41734 ESTABLISHED 12948/postgres:  54
tcp6       0      0 gpdb-master-01:15432 gpdb-seg-04:48534 ESTABLISHED 12948/postgres:  54
tcp6       0      0 gpdb-master-01:15432 gpdb-seg-06:37702 ESTABLISHED 12948/postgres:  54
tcp6       0      0 gpdb-master-01:15432 gpdb-seg-01:36678 ESTABLISHED 12948/postgres:  54
tcp6       0      0 gpdb-master-01:15432 gpdb-seg-08:54626 ESTABLISHED 12948/postgres:  54
tcp6       0      0 gpdb-master-01:15432 gpdb-seg-04:48672 ESTABLISHED 12948/postgres:  54
tcp6       0      0 gpdb-master-01:15432 gpdb-seg-04:49432 ESTABLISHED 12948/postgres:  54
tcp6       0      0 gpdb-master-01:15432 gpdb-seg-03:42044 ESTABLISHED 12948/postgres:  54
tcp6       0      0 gpdb-master-01:15432 gpdb-seg-01:36690 ESTABLISHED 12948/postgres:  54
tcp6       0      0 gpdb-master-01:15432 gpdb-seg-04:48822 ESTABLISHED 12948/postgres:  54
tcp6       0      0 gpdb-master-01:15432 gpdb-seg-01:36730 ESTABLISHED 12948/postgres:  54
tcp6       0      0 gpdb-master-01:15432 gpdb-seg-05:56826 ESTABLISHED 12948/postgres:  54
tcp6       0      0 gpdb-master-01:15432 gpdb-seg-08:54394 ESTABLISHED 12948/postgres:  54
tcp6       0      0 gpdb-master-01:15432 gpdb-seg-03:42314 ESTABLISHED 12948/postgres:  54
tcp6       0      0 gpdb-master-01:15432 gpdb-seg-03:41904 ESTABLISHED 12948/postgres:  54
tcp6       0      0 gpdb-master-01:15432 gpdb-seg-02:36342 ESTABLISHED 12948/postgres:  54
tcp6       0      0 gpdb-master-01:15432 gpdb-seg-02:36394 ESTABLISHED 12948/postgres:  54
tcp6       0      0 gpdb-master-01:15432 gpdb-seg-02:36184 ESTABLISHED 12948/postgres:  54
tcp6       0      0 gpdb-master-01:15432 gpdb-seg-03:41888 ESTABLISHED 12948/postgres:  54
tcp6       0      0 gpdb-master-01:15432 gpdb-seg-03:42234 ESTABLISHED 12948/postgres:  54
tcp6       0      0 gpdb-master-01:15432 gpdb-seg-02:36238 ESTABLISHED 12948/postgres:  54
tcp6       0      0 gpdb-master-01:15432 gpdb-seg-04:49218 ESTABLISHED 12948/postgres:  54
tcp6       0      0 gpdb-master-01:15432 gpdb-seg-07:32624 ESTABLISHED 12948/postgres:  54
tcp6       0      0 gpdb-master-01:15432 gpdb-seg-06:38098 ESTABLISHED 12948/postgres:  54
tcp6       0      0 gpdb-master-01:15432 gpdb-seg-03:42140 ESTABLISHED 12948/postgres:  54
tcp6       0      0 gpdb-master-01:15432 gpdb-seg-01:36608 ESTABLISHED 12948/postgres:  54
tcp6       0      0 gpdb-master-01:15432 gpdb-seg-05:57154 ESTABLISHED 12948/postgres:  54
tcp6       0      0 gpdb-master-01:15432 gpdb-seg-08:54190 ESTABLISHED 12948/postgres:  54
tcp6       0      0 gpdb-master-01:15432 gpdb-seg-06:38746 ESTABLISHED 12948/postgres:  54
tcp6       0      0 gpdb-master-01:15432 gpdb-seg-05:56900 ESTABLISHED 12948/postgres:  54
tcp6       0      0 gpdb-master-01:15432 gpdb-seg-01:36664 ESTABLISHED 12948/postgres:  54
tcp6       0      0 gpdb-master-01:15432 gpdb-seg-07:34196 ESTABLISHED 12948/postgres:  54
tcp6       0      0 gpdb-master-01:15432 gpdb-seg-07:33596 ESTABLISHED 12948/postgres:  54
tcp6       0      0 gpdb-master-01:15432 gpdb-seg-04:49498 ESTABLISHED 12948/postgres:  54
tcp6       0      0 gpdb-master-01:15432 gpdb-seg-06:39296 ESTABLISHED 12948/postgres:  54
tcp6       0      0 gpdb-master-01:15432 gpdb-seg-02:36384 ESTABLISHED 12948/postgres:  54
tcp6       0      0 gpdb-master-01:15432 gpdb-seg-02:36362 ESTABLISHED 12948/postgres:  54
tcp6       0      0 gpdb-master-01:15432 gpdb-seg-06:37984 ESTABLISHED 12948/postgres:  54
tcp6       0      0 gpdb-master-01:15432 gpdb-seg-03:41452 ESTABLISHED 12948/postgres:  54
tcp6       0      0 gpdb-master-01:15432 gpdb-seg-08:54570 ESTABLISHED 12948/postgres:  54
tcp6       0      0 gpdb-master-01:15432 gpdb-seg-02:36352 ESTABLISHED 12948/postgres:  54
tcp6       0      0 gpdb-master-01:15432 gpdb-seg-08:54698 ESTABLISHED 12948/postgres:  54
tcp6       0      0 gpdb-master-01:15432 gpdb-seg-07:32338 ESTABLISHED 12948/postgres:  54
tcp6       0      0 gpdb-master-01:15432 gpdb-seg-02:36336 ESTABLISHED 12948/postgres:  54
tcp6       0      0 gpdb-master-01:15432 gpdb-seg-07:34102 ESTABLISHED 12948/postgres:  54
tcp6       0      0 gpdb-master-01:15432 gpdb-seg-03:41478 ESTABLISHED 12948/postgres:  54
tcp6       0      0 gpdb-master-01:15432 gpdb-seg-06:38800 ESTABLISHED 12948/postgres:  54
tcp6       0      0 gpdb-master-01:15432 gpdb-seg-07:33622 ESTABLISHED 12948/postgres:  54
tcp6       0      0 gpdb-master-01:15432 gpdb-seg-04:48618 ESTABLISHED 12948/postgres:  54
tcp6       0      0 gpdb-master-01:15432 gpdb-seg-02:36400 ESTABLISHED 12948/postgres:  54
tcp6       0      0 gpdb-master-01:15432 gpdb-seg-06:37286 ESTABLISHED 12948/postgres:  54
tcp6       0      0 gpdb-master-01:15432 gpdb-seg-06:38118 ESTABLISHED 12948/postgres:  54
tcp6       0      0 gpdb-master-01:15432 gpdb-seg-01:36728 ESTABLISHED 12948/postgres:  54
tcp6       0      0 gpdb-master-01:15432 gpdb-seg-04:49246 ESTABLISHED 12948/postgres:  54
tcp6       0      0 gpdb-master-01:15432 gpdb-seg-02:36318 ESTABLISHED 12948/postgres:  54
tcp6       0      0 gpdb-master-01:15432 gpdb-seg-03:41984 ESTABLISHED 12948/postgres:  54
tcp6       0      0 gpdb-master-01:15432 gpdb-seg-04:48452 ESTABLISHED 12948/postgres:  54
tcp6       0      0 gpdb-master-01:15432 gpdb-seg-07:32236 ESTABLISHED 12948/postgres:  54
tcp6       0      0 gpdb-master-01:15432 gpdb-seg-07:32318 ESTABLISHED 12948/postgres:  54
tcp6       0      0 gpdb-master-01:15432 gpdb-seg-05:56832 ESTABLISHED 12948/postgres:  54
tcp6       0      0 gpdb-master-01:15432 gpdb-seg-06:37964 ESTABLISHED 12948/postgres:  54
tcp6       0      0 gpdb-master-01:15432 gpdb-seg-03:42116 ESTABLISHED 12948/postgres:  54
tcp6       0      0 gpdb-master-01:15432 gpdb-seg-04:49148 ESTABLISHED 12948/postgres:  54
tcp6       0      0 gpdb-master-01:15432 gpdb-seg-02:36320 ESTABLISHED 12948/postgres:  54
tcp6       0      0 gpdb-master-01:15432 gpdb-seg-04:49082 ESTABLISHED 12948/postgres:  54
tcp6       0      0 gpdb-master-01:15432 gpdb-seg-01:36708 ESTABLISHED 12948/postgres:  54
tcp6       0      0 gpdb-master-01:15432 gpdb-seg-03:41676 ESTABLISHED 12948/postgres:  54
tcp6       0      0 gpdb-master-01:15432 gpdb-seg-07:33964 ESTABLISHED 12948/postgres:  54
tcp6       0      0 gpdb-master-01:15432 gpdb-seg-05:57014 ESTABLISHED 12948/postgres:  54
tcp6       0      0 gpdb-master-01:15432 gpdb-seg-07:33204 ESTABLISHED 12948/postgres:  54
tcp6       0      0 gpdb-master-01:15432 gpdb-seg-04:49562 ESTABLISHED 12948/postgres:  54
tcp6       0      0 gpdb-master-01:15432 gpdb-seg-01:36724 ESTABLISHED 12948/postgres:  54
tcp6       0      0 gpdb-master-01:15432 gpdb-seg-01:36700 ESTABLISHED 12948/postgres:  54
tcp6       0      0 gpdb-master-01:15432 gpdb-seg-08:54634 ESTABLISHED 12948/postgres:  54
tcp6       0      0 gpdb-master-01:15432 gpdb-seg-07:32484 ESTABLISHED 12948/postgres:  54
tcp6       0      0 gpdb-master-01:15432 gpdb-seg-05:57274 ESTABLISHED 12948/postgres:  54
```

When we execute a query with 3 slices, then on the master additional 128*3 sockets are created. The netstat shows that no data is transmitted with bgworker. The same number of sockets is created when `gp_interconnect_type=tcp`

What settings did we forget to set? Used this instruction https://greenplum.docs.pivotal.io/6-12/admin_guide/managing/proxy-ic.html#topic_z4l_lcg_4mb__test_proxy

**Comment by sokolval** [comment]
Additional testing was done in Ubuntu 18.04 LTS with Greenplum 6.16.1 built with --enable-ic-proxy flag, still the Proxe doesn't take connections between segments and new ports are occupied by GP workers within the OS

**Comment by adam8157** [comment]
1, the ports you set seem like postmaster ports, they should be different.
2, are you using IPv6? Could you please try IPv4?

**Comment by sokolval** [comment]
Hi, Adam!
Thank you for reply!
We tried different ports setup with no luck, for our config 1600x ports are not used by segment postgres process, they live on another port.
 IPv4 we also tried but no luck as well.

**Comment by adam8157** [comment]
Could you please check if any segment has such messages in the data/pg_log? I suppose any port conflict would fail the ic-proxy.

`"ic-proxy-server: tcp: fail to bind: permission denied"`

@remotefish do you have other ideas?

BTW, I filed a new issue to address IC-Proxy setting up issue https://github.com/greenplum-db/gpdb/issues/12248

**Comment by adam8157** [comment]
The above analysis is based on the statement "The netstat shows that no data is transmitted with bgworker."

If that statement is not correct, the "additional 128*3 sockets" are not strange at all, because IC proxy is only the proxy for interconnect, like redistribute and broadcast motions. The cluster still has **additional** libpq connections between the master to **every single** postgres process.

**Comment by sokolval** [comment]
Thank you for good point! I'm now testing it on seghost. Will get back with details

**Comment by sokolval** [comment]
Hello all!
I reviewed usage of ports and traffic for proxies, and the outcome is as follows: 
* Greenplum creates a Proxy process which uses port specified in the gp_interconnect_proxy_addresses
* Greenplum QD and QE successfully initiate connections **from** specified ports
* QD and QE connect **to** RANDOM port on segment, thus still using many ports, not as expected by manual: _The interconnect proxies require only one network connection for Greenplum internal communication between two segment instances, so it consumes fewer connections and ports than TCP mode_

For example we have configured proxy to work on ports 1600x and by TCPDUMP for outgoing connections from any Segment Host there are connections from port 1600x to whatever port on other host except 1600x - where IC-PROXY instance expected to live. 
Is this an expected behavior?
.... example below, tcpdump src port 16005 run on host gpdb-6-segment-07...
`13:28:03.857181 IP6 gpdb-6-segment-05.16005 > gpdb-6-segment-07.57416: Flags [P.], seq 72:105, ack 66, win 8192, options [nop,nop,TS val 2234981763 ecr 1527867949], length 33
13:28:03.857086 IP6 gpdb-6-segment-05.16005 > gpdb-6-segment-07.58100: Flags [P.], seq 105:137, ack 66, win 8192, options [nop,nop,TS val 2234981763 ecr 1527867949], length 32
13:28:03.857134 IP6 gpdb-6-segment-05.16005 > gpdb-6-segment-07.57694: Flags [P.], seq 105:137, ack 66, win 8192, options [nop,nop,TS val 2234981763 ecr 1527867949], length 32
13:28:03.859824 IP6 gpdb-6-segment-07.16005 > gpdb-6-segment-08.61994: Flags [.], ack 138, win 8192, options [nop,nop,TS val 716851674 ecr 869025129], length 0
13:28:03.859901 IP6 gpdb-6-segment-07.16005 > gpdb-6-segment-08.61238: Flags [.], ack 66, win 8192, options [nop,nop,TS val 716851674 ecr 869025129], length 0
13:28:03.859927 IP6 gpdb-6-segment-07.16005 > gpdb-6-segment-08.61082: Flags [.], ack 138, win 8192, options [nop,nop,TS val 716851674 ecr 869025129], length 0
13:28:03.860031 IP6 gpdb-6-segment-07.16005 > gpdb-6-segment-08.59602: Flags [.], ack 66, win 8192, options [nop,nop,TS val 716851674 ecr 869025129], length 0
13:28:03.893841 IP6 gpdb-6-segment-03.16005 > gpdb-6-segment-07.14908: Flags [.], ack 98, win 8192, options [nop,nop,TS val 4100476607 ecr 2412225658], le` 

And on the output below no connection comes to this ports - thus even in case Proxy listening there - nobody comes to it:

`gpdb-6-segment-07:~$ sudo tcpdump dst port 16005
tcpdump: verbose output suppressed, use -v or -vv for full protocol decode
listening on eth0, link-type EN10MB (Ethernet), capture size 262144 bytes
^C
0 packets captured
0 packets received by filter
0 packets dropped by kernel`

**Comment by sokolval** [comment]
Hello, All!

We've performed switching on the Proxy on our productive environment and we faced many errors like:

- con1145,cmd411,seg-1,,dx9322,x78283979,sx1,"ERROR","58M01","interconnect error: connection closed prematurely  (seg115 **:**:**:**:**:6be6:4003 pid=34574)","from Remote Connection: contentId=122 at....
- con1407,cmd45,seg-1,,dx10186,x78284555,sx1,"ERROR","58M01","interconnect error: connection closed prematurely  (seg16 **:**:**:**:**:5de4:4000 pid=28670)","from Remote Connection: contentId=115 at"
- con1585,cmd25,seg-1,,dx10404,x78284645,sx1,"ERROR","58M01","interconnect error: connection closed prematurely  (seg115 **:**:**:**:**:6be6:4003 pid=54858)","from Remote Connection: contentId=127 at
- con1473,cmd6,seg-1,,dx8426,,sx1,"ERROR","58M01","interconnect error: connection closed prematurely","from Remote Connection: contentId=98 at"

Wha this have in common together is that Segments were trying to reach out to Proxy on Mirror, as per segment individual logs:
,,,p33746,th-280922304,,,,0,,,seg35,,,,,"WARNING","01000","peer[seg9,dbid139 **:**:**:**:**:b2ae:41238->**:**:**:**:**:5de4:15001]: fail to recv HELLO ACK: connection reset by peer",,,,,,,0,,"ic_proxy_peer.c",686,
,,,p33746,th-280922304,,,,0,,,seg35,,,,,"WARNING","01000","peer[seg9,dbid139 **:**:**:**:**:b2ae:41238->**:**:**:**:**:5de4:15001]: fail to shutdown: socket is not connected",,,,,,,0,,"ic_proxy_peer.c",446,
,,,p33746,th-280922304,,,,0,,,seg35,,,,,"WARNING","01000","peer[seg7,dbid137 **:**:**:**:**:b2ae:47622->**:**:**:**:**:b86a:15003]: fail to recv HELLO ACK: connection reset by peer",,,,,,,0,,"ic_proxy_peer.c",686,
,,,p33746,th-280922304,,,,0,,,seg35,,,,,"WARNING","01000","peer[seg7,dbid137 **:**:**:**:**:b2ae:47622->**:**:**:**:**:b86a:15003]: fail to shutdown: socket is not connected",,,,,,,0,,"ic_proxy_peer.c",446,
,,,p33746,th-280922304,,,,0,,,seg35,,,,,"WARNING","01000","peer[seg65,dbid67 **:**:**:**:**:b2ae:14003->**:**:**:**:**:2708:65416]: fail to shutdown: socket is not connected",,,,,,,0,,"ic_proxy_peer.c",446,

as you can see we have 1400* ports for Primary PROXY and 1500* for Mirror Proxies ...

Not sure if this should be so that Proxy will try reaching Mirrors during all primaries in place.

**Comment by adam8157** [comment]
> QD and QE connect to RANDOM port on segment, thus still using many ports, not as expected by manual: The interconnect proxies require only one network connection for Greenplum internal communication between two segment instances, so it consumes fewer connections and ports than TCP mode

Sorry, what the doc says is "one interconnect connections", it still has other QD-QE connections, will fix it.

> Not sure if this should be so that Proxy will try reaching Mirrors during all primaries in place.

I don't think the proxy should reach the mirror, will confirm this later. Patches are welcome.

Thanks for your report, I appreciate it.

**Comment by sokolval** [comment]
Thank you for the comments, I'm continuing looking into this.
